{"$id":"https://kody-w.github.io/rapp-hive-hub/api/hive-hub/v1/schemas/bucket-index.schema.json","$schema":"https://json-schema.org/draft/2020-12/schema","additionalProperties":true,"properties":{"$schema":{"format":"uri","pattern":"^https://","type":"string"},"algorithm":{"const":"sha256"},"bucketId":{"minLength":1,"type":"string"},"kind":{"const":"bucket-index"},"range":{"properties":{"maximum":{"pattern":"^[a-f0-9]{2}$","type":"string"},"minimum":{"pattern":"^[a-f0-9]{2}$","type":"string"}},"required":["minimum","maximum"],"type":"object"},"records":{"items":{"additionalProperties":false,"properties":{"path":{"pattern":"^(?!/)(?!.*\\.\\.).+$","type":"string"},"ref":{"pattern":"^sha256:[a-f0-9]{64}$","type":"string"},"url":{"format":"uri","pattern":"^https://","type":"string"}},"required":["path","ref","url"],"type":"object"},"type":"array"}},"required":["$schema","algorithm","bucketId","kind","records","range"],"title":"Hive Hub content-addressed bucket index","type":"object"}
