{"$schema":"https://kody-w.github.io/rapp-hive-hub/api/hive-hub/v1/schemas/bucket-index.schema.json","algorithm":"sha256","bucketId":"sha256-00-3f","kind":"bucket-index","range":{"maximum":"3f","minimum":"00"},"records":[{"path":"api/hive-hub/v1/records/sha256/sha256-00-3f/1fe975d6e98712250c02eb4da5729b7c8492c8adafa9d1649e924672de9a2c13.json","ref":"sha256:1fe975d6e98712250c02eb4da5729b7c8492c8adafa9d1649e924672de9a2c13","url":"https://kody-w.github.io/rapp-hive-hub/api/hive-hub/v1/records/sha256/sha256-00-3f/1fe975d6e98712250c02eb4da5729b7c8492c8adafa9d1649e924672de9a2c13.json"},{"path":"api/hive-hub/v1/records/sha256/sha256-00-3f/0b514a026e3874295186be884fb75802669d6517cf7287b3002489c26e8b8b10.json","ref":"sha256:0b514a026e3874295186be884fb75802669d6517cf7287b3002489c26e8b8b10","url":"https://kody-w.github.io/rapp-hive-hub/api/hive-hub/v1/records/sha256/sha256-00-3f/0b514a026e3874295186be884fb75802669d6517cf7287b3002489c26e8b8b10.json"}]}
