{"$schema":"https://kody-w.github.io/rapp-hive-hub/api/hive-hub/v1/schemas/bucket-index.schema.json","algorithm":"sha256","bucketId":"sha256-40-7f","kind":"bucket-index","range":{"maximum":"7f","minimum":"40"},"records":[{"path":"api/hive-hub/v1/records/sha256/sha256-40-7f/7d40d43e78f710bc7d1f40a6133b05834bcc0baba02ce9e75ecd90afe86e7844.json","ref":"sha256:7d40d43e78f710bc7d1f40a6133b05834bcc0baba02ce9e75ecd90afe86e7844","url":"https://kody-w.github.io/rapp-hive-hub/api/hive-hub/v1/records/sha256/sha256-40-7f/7d40d43e78f710bc7d1f40a6133b05834bcc0baba02ce9e75ecd90afe86e7844.json"},{"path":"api/hive-hub/v1/records/sha256/sha256-40-7f/6c39862ea19ff9be39bd04883de90c7d39049c23752ad7a7a8709d5c37c6c26b.json","ref":"sha256:6c39862ea19ff9be39bd04883de90c7d39049c23752ad7a7a8709d5c37c6c26b","url":"https://kody-w.github.io/rapp-hive-hub/api/hive-hub/v1/records/sha256/sha256-40-7f/6c39862ea19ff9be39bd04883de90c7d39049c23752ad7a7a8709d5c37c6c26b.json"}]}
