{"$schema":"https://kody-w.github.io/rapp-hive-hub/api/hive-hub/v1/schemas/bucket-index.schema.json","algorithm":"sha256","bucketId":"sha256-80-bf","kind":"bucket-index","range":{"maximum":"bf","minimum":"80"},"records":[{"path":"api/hive-hub/v1/records/sha256/sha256-80-bf/a3a02bb6b5ed5cad2ce6a98babd31f716bd04cb65a83ab2018cf4989e738f946.json","ref":"sha256:a3a02bb6b5ed5cad2ce6a98babd31f716bd04cb65a83ab2018cf4989e738f946","url":"https://kody-w.github.io/rapp-hive-hub/api/hive-hub/v1/records/sha256/sha256-80-bf/a3a02bb6b5ed5cad2ce6a98babd31f716bd04cb65a83ab2018cf4989e738f946.json"},{"path":"api/hive-hub/v1/records/sha256/sha256-80-bf/a93c16c88d5870afd7b4570e0b2cb4717300c6c4b562b57076449fcae87827a7.json","ref":"sha256:a93c16c88d5870afd7b4570e0b2cb4717300c6c4b562b57076449fcae87827a7","url":"https://kody-w.github.io/rapp-hive-hub/api/hive-hub/v1/records/sha256/sha256-80-bf/a93c16c88d5870afd7b4570e0b2cb4717300c6c4b562b57076449fcae87827a7.json"},{"path":"api/hive-hub/v1/records/sha256/sha256-80-bf/9267a2b97f064c3958ffb04a44d26ef6aaca8cfc1eea1c15fe8b0cdf2b5beb92.json","ref":"sha256:9267a2b97f064c3958ffb04a44d26ef6aaca8cfc1eea1c15fe8b0cdf2b5beb92","url":"https://kody-w.github.io/rapp-hive-hub/api/hive-hub/v1/records/sha256/sha256-80-bf/9267a2b97f064c3958ffb04a44d26ef6aaca8cfc1eea1c15fe8b0cdf2b5beb92.json"}]}
