{"$schema":"https://kody-w.github.io/rapp-hive-hub/api/hive-hub/v1/schemas/bucket-index.schema.json","algorithm":"sha256","bucketId":"sha256-c0-ff","kind":"bucket-index","range":{"maximum":"ff","minimum":"c0"},"records":[{"path":"api/hive-hub/v1/records/sha256/sha256-c0-ff/f472966c6cfa4cb523bc30e2b02844aaa03f3ab1d6c84ad3e901af53a4b65860.json","ref":"sha256:f472966c6cfa4cb523bc30e2b02844aaa03f3ab1d6c84ad3e901af53a4b65860","url":"https://kody-w.github.io/rapp-hive-hub/api/hive-hub/v1/records/sha256/sha256-c0-ff/f472966c6cfa4cb523bc30e2b02844aaa03f3ab1d6c84ad3e901af53a4b65860.json"},{"path":"api/hive-hub/v1/records/sha256/sha256-c0-ff/dedc3a95acd2609406a43ab8d93c77480eda903b14afea4975d1338f04950e5f.json","ref":"sha256:dedc3a95acd2609406a43ab8d93c77480eda903b14afea4975d1338f04950e5f","url":"https://kody-w.github.io/rapp-hive-hub/api/hive-hub/v1/records/sha256/sha256-c0-ff/dedc3a95acd2609406a43ab8d93c77480eda903b14afea4975d1338f04950e5f.json"},{"path":"api/hive-hub/v1/records/sha256/sha256-c0-ff/dda9e219ca9192e544a3089af91fea295c9b7857d8a44f71e789105d6ac8671f.json","ref":"sha256:dda9e219ca9192e544a3089af91fea295c9b7857d8a44f71e789105d6ac8671f","url":"https://kody-w.github.io/rapp-hive-hub/api/hive-hub/v1/records/sha256/sha256-c0-ff/dda9e219ca9192e544a3089af91fea295c9b7857d8a44f71e789105d6ac8671f.json"},{"path":"api/hive-hub/v1/records/sha256/sha256-c0-ff/c5fa3ad31ecb0e26a9a93ae71fa17ef4db365ae4f5dc9d60babf2a4d3ba62480.json","ref":"sha256:c5fa3ad31ecb0e26a9a93ae71fa17ef4db365ae4f5dc9d60babf2a4d3ba62480","url":"https://kody-w.github.io/rapp-hive-hub/api/hive-hub/v1/records/sha256/sha256-c0-ff/c5fa3ad31ecb0e26a9a93ae71fa17ef4db365ae4f5dc9d60babf2a4d3ba62480.json"}]}
